{
  "name": "Alice Doe",
  "description": "Decentralized identity enthusiast and Web3 developer building on Ceramic.",
  "emoji": "🌐",
  "url": "https://alice.example.com",
  "gender": "Non-binary",
  "residenceCountry": "US",
  "nationalities": ["US", "CA"],
  "affiliations": ["Ceramic Network", "DIF"],
  "image": {
    "original": {
      "src": "ipfs://QmYwAPJzv5CZsnA625s3Xf2nemtYgPpHdWEz79ojWnPbdG/avatar.jpg",
      "mimeType": "image/jpeg",
      "width": 400,
      "height": 400,
      "size": 32768
    },
    "alternatives": [
      {
        "src": "ipfs://QmYwAPJzv5CZsnA625s3Xf2nemtYgPpHdWEz79ojWnPbdG/avatar-sm.jpg",
        "mimeType": "image/jpeg",
        "width": 100,
        "height": 100,
        "size": 8192
      }
    ]
  },
  "background": {
    "original": {
      "src": "ipfs://QmYwAPJzv5CZsnA625s3Xf2nemtYgPpHdWEz79ojWnPbdG/background.jpg",
      "mimeType": "image/jpeg",
      "width": 1200,
      "height": 400,
      "size": 131072
    }
  }
}
